{
  "execution_id": "exec-1",
  "tool_call_id": "call-1",
  "run_id": "run-1",
  "session_key_hash": "sha256:aaaaaaaaaaaaaaaaaaaaaaaaaaaaaaaaaaaaaaaaaaaaaaaaaaaaaaaaaaaaaaaa",
  "command_digest": "sha256:bbbbbbbbbbbbbbbbbbbbbbbbbbbbbbbbbbbbbbbbbbbbbbbbbbbbbbbbbbbbbbbb",
  "command": "pytest tests -q",
  "workdir": "/workspace",
  "host": "gateway",
  "placement": {
    "cpu_set": null,
    "numa_node": null,
    "llc_cluster": null,
    "advisory": true
  },
  "profiling": {
    "mode": "off"
  },
  "backend": "marker"
}
